{"contract_version":"1.0","expected":{"ask":{"08-no-tbox-in-business-graph":true,"10-no-blank-nodes":true},"counts":{"urn:kg-mnp:graph:abox:ceb6df7acf1c239319a7c7d71f47e61f48b31451ced026a402b0351f923adc9a":7,"urn:kg-mnp:graph:modeling-provenance:ceb6df7acf1c239319a7c7d71f47e61f48b31451ced026a402b0351f923adc9a":119,"urn:kg-mnp:graph:review-audit:ceb6df7acf1c239319a7c7d71f47e61f48b31451ced026a402b0351f923adc9a":72,"urn:kg-mnp:graph:tbox:ACCOUNT_BILLING:d6b910f57f374f50aab78bd2d395e6942b8eb50ddcd87793e1a8df0ffb9feabd":198,"urn:kg-mnp:graph:tbox:CODE_LIST:da581690236659f7304b622b6773a276b1db84321174557906382fc56f22ba6a":153,"urn:kg-mnp:graph:tbox:COMPLIANCE:7c820b67a9767f58b1fd7b00b4b89e6016ab87a985687f3ed0fe6d0a9ef2755d":520,"urn:kg-mnp:graph:tbox:CORE:a4e638f9ee4bb502dc2227cc2158eb23eb86f8051f08896780b1ffcecf219c3c":49,"urn:kg-mnp:graph:tbox:EVIDENCE_TIME:7c43c985d03884ba57b475222dbe20a711aab1d7da04394907810f6a05aeee2d":285,"urn:kg-mnp:graph:tbox:IDENTITY:7c6cab926d90fa3ddf8d0c6856fd2e2dcce4511db0843d411b9b8dec02e014f1":212,"urn:kg-mnp:graph:tbox:MODELING_PROVENANCE:8252667c1f35386367b7c1373aecefa508067d7341d73a04d38522cefb299c6b":174,"urn:kg-mnp:graph:tbox:PROCESS:3970ff5b06724efdf0672346be6cc9cd33e7314b4f91b7df8fa4a9a441c720f1":294,"urn:kg-mnp:graph:tbox:SERVICE_CONTRACT:b519eac7d3a1619bbbb6f838ee23c7fd1f1e59403c696a67832c646f932ec93a":232,"urn:kg-mnp:graph:tbox:root:db7e4d7ee514fef1c62a54c688290940e11ef0a1d9a96bb866d7b74c01f3e8fd":17},"forbidden_assertion_count":0,"named_graphs":["urn:kg-mnp:graph:abox:ceb6df7acf1c239319a7c7d71f47e61f48b31451ced026a402b0351f923adc9a","urn:kg-mnp:graph:modeling-provenance:ceb6df7acf1c239319a7c7d71f47e61f48b31451ced026a402b0351f923adc9a","urn:kg-mnp:graph:review-audit:ceb6df7acf1c239319a7c7d71f47e61f48b31451ced026a402b0351f923adc9a","urn:kg-mnp:graph:tbox:ACCOUNT_BILLING:d6b910f57f374f50aab78bd2d395e6942b8eb50ddcd87793e1a8df0ffb9feabd","urn:kg-mnp:graph:tbox:CODE_LIST:da581690236659f7304b622b6773a276b1db84321174557906382fc56f22ba6a","urn:kg-mnp:graph:tbox:COMPLIANCE:7c820b67a9767f58b1fd7b00b4b89e6016ab87a985687f3ed0fe6d0a9ef2755d","urn:kg-mnp:graph:tbox:CORE:a4e638f9ee4bb502dc2227cc2158eb23eb86f8051f08896780b1ffcecf219c3c","urn:kg-mnp:graph:tbox:EVIDENCE_TIME:7c43c985d03884ba57b475222dbe20a711aab1d7da04394907810f6a05aeee2d","urn:kg-mnp:graph:tbox:IDENTITY:7c6cab926d90fa3ddf8d0c6856fd2e2dcce4511db0843d411b9b8dec02e014f1","urn:kg-mnp:graph:tbox:MODELING_PROVENANCE:8252667c1f35386367b7c1373aecefa508067d7341d73a04d38522cefb299c6b","urn:kg-mnp:graph:tbox:PROCESS:3970ff5b06724efdf0672346be6cc9cd33e7314b4f91b7df8fa4a9a441c720f1","urn:kg-mnp:graph:tbox:SERVICE_CONTRACT:b519eac7d3a1619bbbb6f838ee23c7fd1f1e59403c696a67832c646f932ec93a","urn:kg-mnp:graph:tbox:root:db7e4d7ee514fef1c62a54c688290940e11ef0a1d9a96bb866d7b74c01f3e8fd"],"review_audit":{"decision_log_id":"urn:kg-mnp:review-decision-log:1113cc369d3cda111e532f1aa740c477d4c7131bc7f513e450c1b6e56170bb69","decisions":[{"decided_at":"2026-08-06T00:03:00Z","decision_id":"urn:kg-mnp:review-decision:0d10bdb40395433c26659686d8df1a63415e3ad154e6c93641ae5d6785ae3cf0","outcome":"CONFIRM","subject":"urn:kg-mnp:candidate:60b4b6016bcae055dd3a6b563aad262f9463f624e53e7e699fe1d9f57de38ea2"},{"decided_at":"2026-08-06T00:04:00Z","decision_id":"urn:kg-mnp:review-decision:207c8c40034977d40594dc8170ff3041ccbd758be345fa85d4d1b478a46760f9","outcome":"CONFIRM","subject":"urn:kg-mnp:candidate:64c2fe578ee0e57db8d7f53ccaeb117aff72c6bf7b53dee63f04eb7740be6cc3"},{"decided_at":"2026-08-06T00:05:00Z","decision_id":"urn:kg-mnp:review-decision:38854bf468213ccfffeacb7b3ca45487cbc5a2ae395d62031674e703ccd234cb","outcome":"CONFIRM","subject":"urn:kg-mnp:candidate:79854a65514427d763de6c40a12d361f6917a81d694e89b273c0f278c28e479c"},{"decided_at":"2026-08-06T00:01:00Z","decision_id":"urn:kg-mnp:review-decision:672129df1711864174517686aadfa2e404c076a9f2d0705266467a4c51af4a26","outcome":"CONFIRM","subject":"urn:kg-mnp:candidate:3dc3320b259383e00326e8f8bf0397725990373ef0c7244b1ad154cb64e131a7"},{"decided_at":"2026-08-06T00:02:00Z","decision_id":"urn:kg-mnp:review-decision:b37794a2a434ad5771ef14ddf60eaa3e3aeb60e2e1f6779e4b4c3610d3920530","outcome":"CONFIRM","subject":"urn:kg-mnp:candidate:d34f2db397b76e7e026a66d34d3953cf3891b2b1fe99135ce4b68810511cece8"}],"review_session_id":"urn:kg-mnp:review-session:d3b188034b59dcf113dd2c2634a713c59727fb0ecd9c13e8d82e63e60bd2ed5d","reviewer_id":"urn:kg-mnp:reviewer:professor-001"},"tbox_module_count":10,"tbox_versions":[{"graph_iri":"urn:kg-mnp:graph:tbox:root:db7e4d7ee514fef1c62a54c688290940e11ef0a1d9a96bb866d7b74c01f3e8fd","module_code":"root","ontology_iri":"https://yangjunjie-lin.github.io/KG-MNP-Demo/ontology/kg-mnp","version_iri":"https://yangjunjie-lin.github.io/KG-MNP-Demo/ontology/1.0.0/kg-mnp"},{"graph_iri":"urn:kg-mnp:graph:tbox:CORE:a4e638f9ee4bb502dc2227cc2158eb23eb86f8051f08896780b1ffcecf219c3c","module_code":"CORE","ontology_iri":"https://yangjunjie-lin.github.io/KG-MNP-Demo/ontology/mnp-core","version_iri":"https://yangjunjie-lin.github.io/KG-MNP-Demo/ontology/1.0.0/mnp-core"},{"graph_iri":"urn:kg-mnp:graph:tbox:IDENTITY:7c6cab926d90fa3ddf8d0c6856fd2e2dcce4511db0843d411b9b8dec02e014f1","module_code":"IDENTITY","ontology_iri":"https://yangjunjie-lin.github.io/KG-MNP-Demo/ontology/mnp-identity","version_iri":"https://yangjunjie-lin.github.io/KG-MNP-Demo/ontology/1.0.0/mnp-identity"},{"graph_iri":"urn:kg-mnp:graph:tbox:ACCOUNT_BILLING:d6b910f57f374f50aab78bd2d395e6942b8eb50ddcd87793e1a8df0ffb9feabd","module_code":"ACCOUNT_BILLING","ontology_iri":"https://yangjunjie-lin.github.io/KG-MNP-Demo/ontology/mnp-account-billing","version_iri":"https://yangjunjie-lin.github.io/KG-MNP-Demo/ontology/1.0.0/mnp-account-billing"},{"graph_iri":"urn:kg-mnp:graph:tbox:SERVICE_CONTRACT:b519eac7d3a1619bbbb6f838ee23c7fd1f1e59403c696a67832c646f932ec93a","module_code":"SERVICE_CONTRACT","ontology_iri":"https://yangjunjie-lin.github.io/KG-MNP-Demo/ontology/mnp-service-contract","version_iri":"https://yangjunjie-lin.github.io/KG-MNP-Demo/ontology/1.0.0/mnp-service-contract"},{"graph_iri":"urn:kg-mnp:graph:tbox:PROCESS:3970ff5b06724efdf0672346be6cc9cd33e7314b4f91b7df8fa4a9a441c720f1","module_code":"PROCESS","ontology_iri":"https://yangjunjie-lin.github.io/KG-MNP-Demo/ontology/mnp-process","version_iri":"https://yangjunjie-lin.github.io/KG-MNP-Demo/ontology/1.0.0/mnp-process"},{"graph_iri":"urn:kg-mnp:graph:tbox:COMPLIANCE:7c820b67a9767f58b1fd7b00b4b89e6016ab87a985687f3ed0fe6d0a9ef2755d","module_code":"COMPLIANCE","ontology_iri":"https://yangjunjie-lin.github.io/KG-MNP-Demo/ontology/mnp-compliance","version_iri":"https://yangjunjie-lin.github.io/KG-MNP-Demo/ontology/1.0.0/mnp-compliance"},{"graph_iri":"urn:kg-mnp:graph:tbox:EVIDENCE_TIME:7c43c985d03884ba57b475222dbe20a711aab1d7da04394907810f6a05aeee2d","module_code":"EVIDENCE_TIME","ontology_iri":"https://yangjunjie-lin.github.io/KG-MNP-Demo/ontology/mnp-evidence-time","version_iri":"https://yangjunjie-lin.github.io/KG-MNP-Demo/ontology/1.0.0/mnp-evidence-time"},{"graph_iri":"urn:kg-mnp:graph:tbox:MODELING_PROVENANCE:8252667c1f35386367b7c1373aecefa508067d7341d73a04d38522cefb299c6b","module_code":"MODELING_PROVENANCE","ontology_iri":"https://yangjunjie-lin.github.io/KG-MNP-Demo/ontology/mnp-modeling-provenance","version_iri":"https://yangjunjie-lin.github.io/KG-MNP-Demo/ontology/1.0.0/mnp-modeling-provenance"},{"graph_iri":"urn:kg-mnp:graph:tbox:CODE_LIST:da581690236659f7304b622b6773a276b1db84321174557906382fc56f22ba6a","module_code":"CODE_LIST","ontology_iri":"https://yangjunjie-lin.github.io/KG-MNP-Demo/ontology/mnp-code-list","version_iri":"https://yangjunjie-lin.github.io/KG-MNP-Demo/ontology/1.0.0/mnp-code-list"}]},"normalization_policy":{"ask":"{boolean: bool}","encoding":"UTF-8","line_endings":"LF","rows":"RDF-term lexical order","variables":"query declaration order"},"queries":{"01-repository-summary":"PREFIX rdf: <http://www.w3.org/1999/02/22-rdf-syntax-ns#>\nPREFIX rdfs: <http://www.w3.org/2000/01/rdf-schema#>\nPREFIX owl: <http://www.w3.org/2002/07/owl#>\nPREFIX sh: <http://www.w3.org/ns/shacl#>\nPREFIX prov: <http://www.w3.org/ns/prov#>\nPREFIX dcterms: <http://purl.org/dc/terms/>\nPREFIX mnp: <https://yangjunjie-lin.github.io/KG-MNP-Demo/ontology/terms#>\nSELECT (COUNT(DISTINCT ?g) AS ?namedGraphCount) (COUNT(*) AS ?quadCount) (COUNT(DISTINCT ?s) AS ?subjectCount) (COUNT(DISTINCT ?p) AS ?predicateCount) (COUNT(DISTINCT ?o) AS ?objectCount) WHERE { GRAPH ?g { ?s ?p ?o } }\n","02-named-graph-counts":"PREFIX rdf: <http://www.w3.org/1999/02/22-rdf-syntax-ns#>\nPREFIX rdfs: <http://www.w3.org/2000/01/rdf-schema#>\nPREFIX owl: <http://www.w3.org/2002/07/owl#>\nPREFIX sh: <http://www.w3.org/ns/shacl#>\nPREFIX prov: <http://www.w3.org/ns/prov#>\nPREFIX dcterms: <http://purl.org/dc/terms/>\nPREFIX mnp: <https://yangjunjie-lin.github.io/KG-MNP-Demo/ontology/terms#>\nSELECT ?g (COUNT(*) AS ?count) WHERE { GRAPH ?g { ?s ?p ?o } } GROUP BY ?g ORDER BY ?g\n","03-business-assertions":"PREFIX rdf: <http://www.w3.org/1999/02/22-rdf-syntax-ns#>\nPREFIX rdfs: <http://www.w3.org/2000/01/rdf-schema#>\nPREFIX owl: <http://www.w3.org/2002/07/owl#>\nPREFIX sh: <http://www.w3.org/ns/shacl#>\nPREFIX prov: <http://www.w3.org/ns/prov#>\nPREFIX dcterms: <http://purl.org/dc/terms/>\nPREFIX mnp: <https://yangjunjie-lin.github.io/KG-MNP-Demo/ontology/terms#>\nSELECT ?s ?p ?o WHERE { GRAPH <urn:kg-mnp:graph:abox:ceb6df7acf1c239319a7c7d71f47e61f48b31451ced026a402b0351f923adc9a> { ?s ?p ?o . FILTER(?p IN (<http://www.w3.org/2000/01/rdf-schema#domain>, <http://www.w3.org/2000/01/rdf-schema#range>, <http://www.w3.org/2000/01/rdf-schema#subClassOf>, <http://www.w3.org/2000/01/rdf-schema#subPropertyOf>, <http://www.w3.org/2002/07/owl#disjointWith>, <http://www.w3.org/2002/07/owl#equivalentClass>, <http://www.w3.org/2002/07/owl#equivalentProperty>) || (?p = <http://www.w3.org/1999/02/22-rdf-syntax-ns#type> && ?o IN (<http://www.w3.org/2002/07/owl#Class>, <http://www.w3.org/2002/07/owl#DatatypeProperty>, <http://www.w3.org/2002/07/o